{
  "schema_version": "1.0",
  "patch_id": "REPLACE_WITH_PATCH_ID",
  "artifact_sha256": "REPLACE_WITH_ARTIFACT_SHA256",
  "target": {
    "family": "database",
    "method": "opatch",
    "topology": "single_instance",
    "database_unique_name": "REPLACE_WITH_DISCOVERED_DB_UNIQUE_NAME",
    "platform_id": "REPLACE_WITH_ARTIFACT_ARU_PLATFORM_ID"
  },
  "execution": {
    "adapter": "database_single_instance_opatch",
    "operations": [
      "database_shutdown",
      "database_opatch_apply",
      "database_startup",
      "database_datapatch"
    ]
  },
  "required_opatch_version": "REPLACE_WITH_README_MINIMUM",
  "oracle_references": [
    {
      "kind": "patch_readme",
      "identifier": "REPLACE_WITH_README_RELATIVE_PATH",
      "sha256": "REPLACE_WITH_README_SHA256"
    },
    {
      "kind": "mos_note",
      "identifier": "REPLACE_WITH_APPROVED_MOS_NOTE",
      "sha256": "REPLACE_WITH_APPROVED_EXPORT_SHA256"
    }
  ],
  "mandatory_prechecks": [
    "artifact_integrity",
    "platform_applicability",
    "opatch_version",
    "conflict_check",
    "backup_or_restore"
  ],
  "mandatory_postchecks": [
    "binary_inventory",
    "service_health"
  ],
  "rollback": {
    "mode": "opatch_rollback",
    "precondition": "REPLACE_WITH_EXACT_README_ROLLBACK_CONDITION"
  }
}
